{"$schema":"https://json-schema.org/draft/2020-12/schema","type":"object","additionalProperties":false,"required":["schemaVersion","dataNature","dataTime","generatedAt","runId","data"],"properties":{"schemaVersion":{"const":"1.0"},"dataNature":{"enum":["模拟数据","真实数据","真实数据+模拟补齐"]},"dataTime":{"type":"string","pattern":"^\\d{4}-\\d{2}-\\d{2}T"},"generatedAt":{"type":"string"},"runId":{"type":"string","minLength":1},"data":{"type":["object","array"]}}}
