{"schemaVersion": "1.0", "dataNature": "真实数据+模拟补齐", "dataTime": "2025-08-01T07:00:00+08:00", "generatedAt": "2026-09-15T15:06:07+08:00", "runId": "beijing_20260915_hybrid_v1", "data": {"storage": "hdfs://localhost:9000/charging_real/beijing", "master": "yarn", "stages": [{"run_id": "beijing_20260915_hybrid_v1", "stage": "download_figshare_cc_by_4", "status": "SUCCESS", "application_id": "external-http"}, {"run_id": "beijing_20260915_hybrid_v1", "stage": "pyspark_clean_sparksql_gbt", "status": "SUCCESS", "application_id": "application_1789454826925_0003"}, {"run_id": "beijing_20260915_hybrid_v1", "stage": "residual_cnn", "status": "SUCCESS", "application_id": "pytorch-local-cpu+hdfs-artifact"}, {"run_id": "beijing_20260915_hybrid_v1", "stage": "simulated_field_fallback", "status": "SUCCESS", "application_id": "20260914_hadoop2"}], "layers": {"ods": "/charging_real/beijing/ods", "dwd": "/charging_real/beijing/dwd/sessions", "dws": "/charging_real/beijing/features/hourly", "features": "/charging_real/beijing/features/hourly/version=beijing_20260915_spark_v3", "models": "/charging_real/beijing/models/residual_cnn/version=beijing_20260915_cnn_v1", "ads": "/charging_real/beijing/code/web/data/runs"}, "quality_rule_count": 3, "warning_rows": 0, "error_rule_hits": 83206, "status": "SUCCESS", "conservation": {"status": "PASS_BY_CONSTRUCTION", "method": "按真实会话持续时间分摊，小时份额之和保持订单总电量"}, "source_manifest": [{"name": "A city-scale dataset of public electric vehicle charging transactions and infrastructure", "rows": 8544695, "sha256": "MD5逐文件校验", "license": "CC BY 4.0", "url": "https://figshare.com/articles/dataset/_b_A_city-scale_dataset_of_public_electric_vehicle_charging_transactions_and_infrastructure_b_/31952289"}], "fallback_sources": [{"domain": "用户预测与故障遥测", "run_id": "20260914_hadoop2", "nature": "北京模拟数据"}], "model_count": 20, "baseline_fallbacks": 6, "test_degraded_count": 7, "winner_counts": {"1": {"residual_cnn": 2, "spark_gbt": 15, "8week": 3}, "6": {"residual_cnn": 5, "spark_gbt": 3, "8week": 12}, "24": {"residual_cnn": 0, "spark_gbt": 14, "8week": 6}}}}