{"schemaVersion": "1.0", "dataNature": "模拟数据", "dataTime": "2026-09-11T23:00:00+08:00", "generatedAt": "2026-09-14T16:45:38.327952+08:00", "runId": "20260914_hadoop2", "data": [{"station_id": 1010, "name": "海淀区上地信息产业基地·直流充电站", "district": "海淀区", "device_count": 10}, {"station_id": 1001, "name": "朝阳区国贸CBD·交直流充电站", "district": "朝阳区", "device_count": 12}, {"station_id": 1034, "name": "西城区金融街·交直流充电站", "district": "西城区", "device_count": 10}, {"station_id": 1008, "name": "朝阳区欢乐谷景区·交直流充电站", "district": "朝阳区", "device_count": 5}, {"station_id": 1035, "name": "西城区西单大悦城·直流充电站", "district": "西城区", "device_count": 7}, {"station_id": 1009, "name": "海淀区中关村软件园·交直流充电站", "district": "海淀区", "device_count": 14}, {"station_id": 1045, "name": "门头沟区潭柘寺景区·交直流充电站", "district": "门头沟区", "device_count": 4}, {"station_id": 1032, "name": "昌平区十三陵景区·交直流充电站", "district": "昌平区", "device_count": 5}, {"station_id": 1011, "name": "海淀区五道口·交直流充电站", "district": "海淀区", "device_count": 7}, {"station_id": 1040, "name": "顺义区首都机场T3·直流充电站", "district": "顺义区", "device_count": 8}, {"station_id": 1031, "name": "昌平区天通苑·交直流充电站", "district": "昌平区", "device_count": 7}, {"station_id": 1003, "name": "朝阳区三里屯太古里·交直流充电站", "district": "朝阳区", "device_count": 8}, {"station_id": 1024, "name": "通州区宋庄·交直流充电站", "district": "通州区", "device_count": 5}, {"station_id": 1020, "name": "丰台区京港澳高速·直流充电站", "district": "丰台区", "device_count": 10}, {"station_id": 1036, "name": "西城区牛街·交流充电站", "district": "西城区", "device_count": 4}, {"station_id": 1016, "name": "丰台区丽泽商务区·交直流充电站", "district": "丰台区", "device_count": 10}, {"station_id": 1013, "name": "海淀区万柳·交流充电站", "district": "海淀区", "device_count": 6}, {"station_id": 1044, "name": "石景山区首钢园·交直流充电站", "district": "石景山区", "device_count": 8}, {"station_id": 1025, "name": "大兴区亦庄开发区·交直流充电站", "district": "大兴区", "device_count": 12}, {"station_id": 1023, "name": "通州区梨园·交流充电站", "district": "通州区", "device_count": 6}, {"station_id": 1022, "name": "通州区环球影城景区·交直流充电站", "district": "通州区", "device_count": 8}, {"station_id": 1002, "name": "朝阳区望京SOHO·直流充电站", "district": "朝阳区", "device_count": 10}, {"station_id": 1017, "name": "丰台区万达广场·直流充电站", "district": "丰台区", "device_count": 8}, {"station_id": 1033, "name": "昌平区京藏高速·直流充电站", "district": "昌平区", "device_count": 9}, {"station_id": 1046, "name": "密云区古北水镇·交直流充电站", "district": "密云区", "device_count": 5}, {"station_id": 1019, "name": "丰台区南苑·交直流充电站", "district": "丰台区", "device_count": 6}, {"station_id": 1038, "name": "东城区东直门·交流充电站", "district": "东城区", "device_count": 5}, {"station_id": 1005, "name": "朝阳区亚运村·交流充电站", "district": "朝阳区", "device_count": 6}, {"station_id": 1039, "name": "东城区永定门·交直流充电站", "district": "东城区", "device_count": 5}, {"station_id": 1029, "name": "昌平区未来科学城·交直流充电站", "district": "昌平区", "device_count": 10}, {"station_id": 1027, "name": "大兴区京开高速·直流充电站", "district": "大兴区", "device_count": 9}, {"station_id": 1007, "name": "朝阳区首都机场高速·直流充电站", "district": "朝阳区", "device_count": 10}, {"station_id": 1014, "name": "海淀区圆明园景区·交直流充电站", "district": "海淀区", "device_count": 5}, {"station_id": 1012, "name": "海淀区世纪金源购物中心·直流充电站", "district": "海淀区", "device_count": 8}, {"station_id": 1030, "name": "昌平区回龙观·交流充电站", "district": "昌平区", "device_count": 7}, {"station_id": 1015, "name": "海淀区京新高速·直流充电站", "district": "海淀区", "device_count": 9}, {"station_id": 1041, "name": "顺义区后沙峪·交流充电站", "district": "顺义区", "device_count": 5}, {"station_id": 1018, "name": "丰台区方庄·交流充电站", "district": "丰台区", "device_count": 6}, {"station_id": 1037, "name": "东城区王府井·交直流充电站", "district": "东城区", "device_count": 7}, {"station_id": 1021, "name": "通州区运河商务区·交直流充电站", "district": "通州区", "device_count": 9}, {"station_id": 1043, "name": "房山区京昆高速·直流充电站", "district": "房山区", "device_count": 8}, {"station_id": 1047, "name": "怀柔区雁栖湖·交直流充电站", "district": "怀柔区", "device_count": 5}, {"station_id": 1042, "name": "房山区良乡·交流充电站", "district": "房山区", "device_count": 5}, {"station_id": 1028, "name": "大兴区黄村·交流充电站", "district": "大兴区", "device_count": 5}, {"station_id": 1006, "name": "朝阳区双井·交直流充电站", "district": "朝阳区", "device_count": 6}, {"station_id": 1004, "name": "朝阳区朝阳大悦城·直流充电站", "district": "朝阳区", "device_count": 8}, {"station_id": 1026, "name": "大兴区西红门荟聚·直流充电站", "district": "大兴区", "device_count": 9}]}