{"schemaVersion": "1.0", "dataNature": "模拟数据", "dataTime": "2026-09-11T23:00:00+08:00", "generatedAt": "2026-09-14T14:13:43.820050+08:00", "runId": "20260914_hadoop1", "data": {"version": "20260914_hadoop1", "feature_version": "20260914_hadoop1", "application_id": "application_1789135312450_0013", "time_model": "global_popular", "energy_model": "user_mean", "evaluation": {"validation": {"time": {"als": {"n": 2000, "hit_rate_1": 0.011, "hit_rate_3": 0.0425, "mrr": 0.06130567856657192, "ndcg_3": 0.028648481426786138}, "user_history": {"n": 2000, "hit_rate_1": 0.0105, "hit_rate_3": 0.035, "mrr": 0.053874725300391675, "ndcg_3": 0.024059297535714577}, "global_popular": {"n": 2000, "hit_rate_1": 0.0205, "hit_rate_3": 0.0445, "mrr": 0.06868708873074572, "ndcg_3": 0.034594876057143314}}, "energy": {"als": {"n": 2000, "mae": 8.476664144325255, "rmse": 10.201034831111857, "wmape": 0.2921629581947859, "smape": 0.3036694227788768, "r2": 0.30524462066719293}, "user_mean": {"n": 2000, "mae": 8.160217800751306, "rmse": 9.732119850073353, "wmape": 0.28125608512840605, "smape": 0.29333007167296443, "r2": 0.3676487893382363}, "slot_mean": {"n": 2000, "mae": 9.997086870698842, "rmse": 12.236475089868607, "wmape": 0.34456696923977553, "smape": 0.3541153578997582, "r2": 0.0003312455219963706}}}, "test": {"time": {"als": {"n": 2000, "hit_rate_1": 0.015, "hit_rate_3": 0.0655, "mrr": 0.075321542970825, "ndcg_3": 0.04313045457857205}, "user_history": {"n": 2000, "hit_rate_1": 0.0125, "hit_rate_3": 0.039, "mrr": 0.0551943140012877, "ndcg_3": 0.027648481426786137}, "global_popular": {"n": 2000, "hit_rate_1": 0.0235, "hit_rate_3": 0.0515, "mrr": 0.07976431122828725, "ndcg_3": 0.03972580581071476}}, "energy": {"als": {"n": 2000, "mae": 8.603829154281614, "rmse": 10.342692431557401, "wmape": 0.2998044700215402, "smape": 0.3105066490739665, "r2": 0.30128739880824995}, "user_mean": {"n": 2000, "mae": 8.271898429446853, "rmse": 9.819755784337046, "wmape": 0.2882381879326602, "smape": 0.2997422822812481, "r2": 0.37015638644748816}, "slot_mean": {"n": 2000, "mae": 10.161493555879586, "rmse": 12.375498807799024, "wmape": 0.3540820180781638, "smape": 0.3641286252967649, "r2": -0.00036106729811491434}}}}, "user_count": 2000, "coverage": 1.0, "cold_start_count": 0, "energy_bounds": [9.02, 60.7], "global_energy_mean": 29.00673294180348, "fallback": "用户均值 → 同时段均值 → 全局均值；新用户只展示群体分布", "origin": "2026-09-11T23:00:00+08:00", "generated_at": "2026-09-14T11:49:25.535776+08:00", "heatmap": [[0, 0, 311], [1, 0, 0], [2, 0, 0], [3, 0, 0], [4, 0, 0], [5, 0, 0], [6, 0, 777], [7, 0, 2456], [8, 0, 3909], [9, 0, 3825], [10, 0, 4164], [11, 0, 5875], [12, 0, 6237], [13, 0, 4902], [14, 0, 4212], [15, 0, 4410], [16, 0, 5656], [17, 0, 7403], [18, 0, 7878], [19, 0, 6627], [20, 0, 5077], [21, 0, 3346], [22, 0, 1659], [23, 0, 685], [0, 1, 332], [1, 1, 0], [2, 1, 0], [3, 1, 0], [4, 1, 0], [5, 1, 0], [6, 1, 757], [7, 1, 2423], [8, 1, 3759], [9, 1, 3804], [10, 1, 4301], [11, 1, 5865], [12, 1, 6133], [13, 1, 4820], [14, 1, 4199], [15, 1, 4621], [16, 1, 5595], [17, 1, 7642], [18, 1, 7721], [19, 1, 6607], [20, 1, 5109], [21, 1, 3265], [22, 1, 1721], [23, 1, 655], [0, 2, 346], [1, 2, 0], [2, 2, 0], [3, 2, 0], [4, 2, 0], [5, 2, 0], [6, 2, 752], [7, 2, 2469], [8, 2, 3755], [9, 2, 3845], [10, 2, 4223], [11, 2, 5942], [12, 2, 6350], [13, 2, 4809], [14, 2, 4377], [15, 2, 4624], [16, 2, 5629], [17, 2, 7668], [18, 2, 7955], [19, 2, 6579], [20, 2, 5132], [21, 2, 3437], [22, 2, 1632], [23, 2, 693], [0, 3, 339], [1, 3, 0], [2, 3, 0], [3, 3, 0], [4, 3, 0], [5, 3, 0], [6, 3, 757], [7, 3, 2502], [8, 3, 3913], [9, 3, 3833], [10, 3, 4156], [11, 3, 5878], [12, 3, 6331], [13, 3, 4952], [14, 3, 4279], [15, 3, 4588], [16, 3, 5602], [17, 3, 7563], [18, 3, 8045], [19, 3, 6477], [20, 3, 5161], [21, 3, 3417], [22, 3, 1666], [23, 3, 684], [0, 4, 358], [1, 4, 0], [2, 4, 0], [3, 4, 0], [4, 4, 0], [5, 4, 0], [6, 4, 772], [7, 4, 2464], [8, 4, 3874], [9, 4, 3927], [10, 4, 4027], [11, 4, 5936], [12, 4, 6179], [13, 4, 4864], [14, 4, 4163], [15, 4, 4533], [16, 4, 5668], [17, 4, 7574], [18, 4, 7784], [19, 4, 6363], [20, 4, 5060], [21, 4, 3386], [22, 4, 1609], [23, 4, 687], [0, 5, 456], [1, 5, 0], [2, 5, 0], [3, 5, 0], [4, 5, 0], [5, 5, 0], [6, 5, 949], [7, 5, 1987], [8, 5, 2876], [9, 5, 4000], [10, 5, 5062], [11, 5, 6569], [12, 5, 7108], [13, 5, 6937], [14, 5, 7161], [15, 5, 6425], [16, 5, 7023], [17, 5, 7291], [18, 5, 6936], [19, 5, 6093], [20, 5, 4341], [21, 5, 2598], [22, 5, 1387], [23, 5, 485], [0, 6, 463], [1, 6, 0], [2, 6, 0], [3, 6, 0], [4, 6, 0], [5, 6, 0], [6, 6, 1012], [7, 6, 1958], [8, 6, 2834], [9, 6, 3873], [10, 6, 5012], [11, 6, 6580], [12, 6, 6929], [13, 6, 7080], [14, 6, 6930], [15, 6, 6261], [16, 6, 6977], [17, 6, 7092], [18, 6, 6886], [19, 6, 6022], [20, 6, 4283], [21, 6, 2550], [22, 6, 1301], [23, 6, 486]], "next_slot_distribution": [0, 0, 0, 0, 0, 0, 0, 0, 0, 0, 0, 0, 0, 0, 0, 0, 0, 0, 0, 0, 0, 0, 0, 0, 0, 0, 0, 0, 0, 0, 0, 0, 0, 0, 0, 0, 0, 0, 0, 0, 0, 0, 0, 0, 0, 0, 0, 0, 0, 0, 0, 0, 0, 0, 0, 0, 0, 0, 0, 0, 0, 0, 0, 0, 0, 0, 0, 0, 0, 0, 0, 0, 0, 0, 0, 0, 0, 0, 0, 0, 0, 0, 0, 0, 0, 0, 0, 0, 0, 0, 2000, 0, 0, 0, 0, 0, 0, 0, 0, 0, 0, 0, 0, 0, 0, 0, 0, 0, 0, 0, 0, 0, 0, 0, 0, 0, 0, 0, 0, 0, 0, 0, 0, 0, 0, 0, 0, 0, 0, 0, 0, 0, 0, 0, 0, 0, 0, 0, 0, 0, 0, 0, 0, 0, 0, 0, 0, 0, 0, 0, 0, 0, 0, 0, 0, 0, 0, 0, 0, 0, 0, 0, 0, 0, 0, 0, 0, 0], "next_day_distribution": {"2026-09-17": 2000}, "energy_distribution": [{"from": 15.1244, "to": 18.250213968253966, "count": 254}, {"from": 18.250213968253966, "to": 21.376027936507935, "count": 20}, {"from": 21.376027936507935, "to": 24.501841904761903, "count": 264}, {"from": 24.501841904761903, "to": 27.62765587301587, "count": 328}, {"from": 27.62765587301587, "to": 30.75346984126984, "count": 282}, {"from": 30.75346984126984, "to": 33.879283809523805, "count": 305}, {"from": 33.879283809523805, "to": 37.00509777777777, "count": 216}, {"from": 37.00509777777777, "to": 40.13091174603174, "count": 166}, {"from": 40.13091174603174, "to": 43.25672571428571, "count": 130}, {"from": 43.25672571428571, "to": 46.38253968253968, "count": 35}], "mean_next_kwh": 29.032186427094288, "cold_start_example": {"personalized": false, "next_kwh": 29.00673294180348, "basis": "全局训练均值"}}}